{
  "protocol": {
    "status": "draft"
  },
  "contributors": {
    "count": 3
  },
  "contributions": {
    "total": 12,
    "verified": 8
  },
  "nodes": {
    "total": 5,
    "active": 3,
    "byType": {
      "compute": 1,
      "data": 1,
      "storage": 1,
      "validation": 1,
      "developer": 1
    },
    "byRegion": {
      "SG": 1,
      "CN": 1,
      "US": 1,
      "EU": 1,
      "hidden": 1
    }
  },
  "reputation": {
    "profiles": 3,
    "snapshots": 3
  },
  "sources": {
    "mainnet": "example",
    "contributionPolicy": "002-draft-1",
    "reputationPolicy": "003-draft-1",
    "nodeRegistryPolicy": "004-draft-1"
  },
  "generatedAt": "2026-08-29T00:00:00Z"
}
